{
  "name": "adr-kit",
  "description": "Architecture Decision Record toolkit for AI coding agents: bootstrap, multi-format authoring, bounded deterministic enforcement, lifecycle workflows, context injection, generated graph indexes, and local health checks.",
  "version": "0.61.0",
  "author": {
    "name": "Robert van den Breemen",
    "url": "https://github.com/rvdbreemen"
  },
  "homepage": "https://github.com/rvdbreemen/adr-kit",
  "repository": "https://github.com/rvdbreemen/adr-kit.git",
  "license": "MIT",
  "keywords": [
    "adr",
    "architecture-decision-records",
    "claude-code",
    "github-copilot",
    "codex",
    "agent-skills",
    "ai-coding-assistant",
    "documentation",
    "decision-records",
    "verification-gates",
    "anti-rationalization",
    "lint",
    "guardian",
    "staleness-detection"
  ],
  "dependencies": []
}
